comment_id,parent_id,author,body,post_id,post_author,body_clean,sentiment
j6eazfa,t3_10ofg45,Former_Stick,Fuck yes,10ofg45,obycf,fuck yes,positive
j6edwfa,t3_10ofg45,FreeDifficulty8656,Nice breasts,10ofg45,obycf,nice breasts,positive
j6eotzv,t3_10ofg45,No_Start1539,Yes master,10ofg45,obycf,yes master,positive
j6euu0y,t3_10ofg45,Level_Ad_4926,"On my knees for you, may I eat you out while you making clouds?!",10ofg45,obycf,on my knees for you may i eat you out while you making clouds,positive
j6f2htp,t3_10ofg45,Many-Accountant-1953,As you command. I do as you say. Here to obey and be you bitch. Use my spun out hole. Bi guy here,10ofg45,obycf,as you command i do as you say here to obey and be you bitch use my spun out hole bi guy here,negative
j6f531r,t3_10ofg45,Spiritual-Post-4006,Flawless...,10ofg45,obycf,flawless,positive
j6fcg6m,t3_10ofg45,99Dutch99,You had me at bow down . Mesmerizing among other things,10ofg45,obycf,you had me at bow down  mesmerizing among other things,positive
j6fdvxw,t3_10ofg45,Traditional-Shirt-53,Damn how I wish i was there rn 🤤,10ofg45,obycf,damn how i wish i was there rn,negative
j6fofoz,t3_10ofg45,Medical_Return9051,Damn you cute,10ofg45,obycf,damn you cute,positive
j6gawei,t3_10ofg45,Huge_Development9156,I can’t get lower unless I start digging!!!,10ofg45,obycf,i cant get lower unless i start digging,negative
j6gg9da,t3_10ofg45,RayRayS55,Looking delicious babe😉,10ofg45,obycf,looking delicious babe,positive
j6gknpw,t3_10ofg45,No-Link-1802,Definitely would,10ofg45,obycf,definitely would,positive
j6gmgyt,t3_10ofg45,No_Yogurtcloset_3146,Tease,10ofg45,obycf,tease,neutral
j6gncox,t3_10ofg45,Bob-AF,There were clouds??  Hehe,10ofg45,obycf,there were clouds  hehe,neutral
j6gt5aq,t3_10ofg45,Bonemane69,Damn i want you,10ofg45,obycf,damn i want you,positive
j6gumg4,t3_10ofg45,Careful_Bobcat_267,God your hot I would love to smoke with u,10ofg45,obycf,god your hot i would love to smoke with u,positive
j6gwz7l,t3_10ofg45,Pleasant-Ad-1963,I'm on my knees!!!,10ofg45,obycf,im on my knees,neutral
j6h3xck,t3_10ofg45,SuperDuper85,looking as attractive and hot as I've seen u,10ofg45,obycf,looking as attractive and hot as ive seen u,positive
j6h40l8,t3_10ofg45,NachoMakeitstretch,Mmmm hell yea wouldn't be the 1st time  i woke up with some pussy shoved in my face 👅💦💦,10ofg45,obycf,mmmm hell yea wouldnt be the 1st time  i woke up with some pussy shoved in my face,positive
j6hc6xs,t3_10ofg45,Designer_Disaster741,Was up,10ofg45,obycf,was up,neutral
j6ijm8j,t3_10ofg45,No_Start1539,U got it master,10ofg45,obycf,u got it master,positive
j6iu5ha,t3_10ofg45,Status-Tangerine-721,Maybe... maybe lol,10ofg45,obycf,maybe maybe lol,neutral
j6ixvgj,t3_10ofg45,RemarkableAd105,Love them titties,10ofg45,obycf,love them titties,positive
j6knsfz,t3_10ofg45,DanielSanchez689,Sexy ass girl you!!!,10ofg45,obycf,sexy ass girl you,positive
j6ktxby,t3_10ofg45,Environmental-Cry591,"I want to be high AF with you while making your pussy squirt & those legs shake from having multiple  intense orgasms that leaves you craving more cock every 20 minutes until I’ve fucked every single orgasm your body had in it ,out of you! ❌❌❌🥵🔥😈",10ofg45,obycf,i want to be high af with you while making your pussy squirt  those legs shake from having multiple  intense orgasms that leaves you craving more cock every 20 minutes until ive fucked every single orgasm your body had in it out of you,positive
j6l89v5,t3_10ofg45,MouthfulOfcumsissy,God damn just ur rock hard nips alone make me wanna cum in my own mouth,10ofg45,obycf,god damn just ur rock hard nips alone make me wanna cum in my own mouth,positive
j6l8ans,t3_10ofg45,ProlificLicker,I will bow down to you. I will worship and suck your feet and your toes and worship your pussy. I love eating pussy every day several times today and I love sharing nothing hotter than a room full of guys off fucking my girl.,10ofg45,obycf,i will bow down to you i will worship and suck your feet and your toes and worship your pussy i love eating pussy every day several times today and i love sharing nothing hotter than a room full of guys off fucking my girl,positive
j6m4p12,t3_10ofg45,No_Start1539,May i lick ur pussy master,10ofg45,obycf,may i lick ur pussy master,neutral
j78fs2f,t3_10ofg45,Weary-Place-5902,Damn 🤩💖,10ofg45,obycf,damn,negative
j7p295q,t3_10ofg45,willrockyou699669,Still wish you would’ve stopped in Myrtle,10ofg45,obycf,still wish you wouldve stopped in myrtle,negative
j8bzab1,t3_10ofg45,Free_Hunter_5385,"OK put me where you want me tell me what to do
🥀💌🥀GORGEOUS 🥀💌🥀",10ofg45,obycf,ok put me where you want me tell me what to do gorgeous,neutral
j8glt1m,t3_10ofg45,Cheetah_Slow,I would love to get high with you and beat that pretty little pussy up for hours... Lick you up and dick you down 😈😈,10ofg45,obycf,i would love to get high with you and beat that pretty little pussy up for hours lick you up and dick you down,positive
j9116p6,t3_10ofg45,LingonberryFinal7296,I'm ready,10ofg45,obycf,im ready,positive
j93wtkz,t3_10ofg45,Inevitable-Sweet-360,Are your nipples always that hard or just when your spun and horny?,10ofg45,obycf,are your nipples always that hard or just when your spun and horny,neutral
jb2uxd5,t3_10ofg45,Search4me1,i love the melee ones the best yahoo,10ofg45,obycf,i love the melee ones the best yahoo,positive
j6i8niw,t1_j6e9gte,obycf,"Just kiss my feet. Well the earth deserves love too tbh we are quite mean to her as a species. 

Ok proceed 🎟️",10ofg45,obycf,just kiss my feet well the earth deserves love too tbh we are quite mean to her as a species  ok proceed,negative
j6i87qt,t1_j6egzjw,obycf,"In my defense, I get way too many msgs and I’m only 1 person so that inevitably leaves a lot of msgs unread. But I will check my dms ❤️",10ofg45,obycf,in my defense i get way too many msgs and im only 1 person so that inevitably leaves a lot of msgs unread but i will check my dms,negative
j6eli1s,t1_j6egzjw,scottyboyandgirl,Good luck with that bud…shes not much of a communicator …lol,10ofg45,obycf,good luck with that budshes not much of a communicator lol,negative
j6i89na,t1_j6eotzv,obycf,That’s what I like to hear 😌,10ofg45,obycf,thats what i like to hear,positive
j6i8ag7,t1_j6fvf1x,obycf,Thank you!!,10ofg45,obycf,thank you,positive
j6i8bcf,t1_j6gawei,obycf,I’ll get you a shovel,10ofg45,obycf,ill get you a shovel,neutral
j6icsu5,t1_j6gncox,obycf,I love your username lol,10ofg45,obycf,i love your username lol,positive
j6i8dqq,t1_j6gwz7l,obycf,Perfect 😉,10ofg45,obycf,perfect,positive
j6i8f98,t1_j6gykhr,obycf,❤️😉 you like?,10ofg45,obycf,you like,neutral
j6i8g4a,t1_j6gys2l,obycf,Haha I love this,10ofg45,obycf,haha i love this,positive
j6i8h31,t1_j6h3xck,obycf,Thank you!!,10ofg45,obycf,thank you,positive
j95qjxm,t1_j93wtkz,obycf,They are always this hard,10ofg45,obycf,they are always this hard,negative
j6ltjq9,t1_j6i87qt,ProlificLicker,I’ve always wanted to try being submissive to a woman I’ve always been dominant but I like being told what to do sometimes is for the right woman I’ll do just about anything that’s how you know it’s what she likes. That’s what I like to hear what the woman likes and make it come true,10ofg45,obycf,ive always wanted to try being submissive to a woman ive always been dominant but i like being told what to do sometimes is for the right woman ill do just about anything thats how you know its what she likes thats what i like to hear what the woman likes and make it come true,neutral
